<?xml version="1.0" encoding="UTF-8"?>
<Plugin version="1.0" id="NginxPlugin" name="NginxPlugin" 
	class="com.mainsteam.stm.plugin.nginx.NginxPluginSession"
	xmlns:xsi="http://www.w3.org/2001/XMLSchema-instance" 
	xsi:noNamespaceSchemaLocation="../schema/Plugin.xsd">
	<MaxActiveSession>1</MaxActiveSession>
	<MaxidleSession>0</MaxidleSession>
	<SessionTTL>10000</SessionTTL>
	<ObjectCacheTimeout>30000</ObjectCacheTimeout>
	<PluginInitParameters>
		<parameter id="NginxGrpBox" boxStyle="GroupBox" name="Niginx服务器连接信息"
			displayOrder="1" isEdit="false" isDisplay="true" isSessionKey="false">
			<DefaultValue />
			<HelpInfo>Niginx服务器连接信息</HelpInfo>
		</parameter>
		<parameter id="IP" boxStyle="IPField" name="IP地址" displayOrder="1" valueValidate="/^([0,1]?\d{0,2}|2[0-4]\d|25[0-5])\.([0,1]?\d{0,2}|2[0-4]\d|25[0-5])\.([0,1]?\d{0,2}|2[0-4]\d|25[0-5])\.([0,1]?\d{0,2}|2[0-4]\d|25[0-5])$/"
			isEdit="true" isDisplay="true" isSessionKey="true">
			<DefaultValue></DefaultValue>
			<HelpInfo>待发现Niginx服务器的IP地址</HelpInfo>
			<errorInfo>请输入正确的IP格式，例如192.168.0.1</errorInfo>
		</parameter>
		<parameter id="PAGENAME" boxStyle="Input"  
			name="Niginx地址参数" displayOrder="4" isEdit="true" 
			isDisplay="true" mustInput="true" isSessionKey="true">
			<DefaultValue></DefaultValue>
			<HelpInfo>Niginx地址参数，如 http://172.16.7.127/c-server-status</HelpInfo>
		</parameter>
		<parameter id="nginxPort" boxStyle="Input"  
			name="端口" displayOrder="4" isEdit="true" 
			isDisplay="true" mustInput="true" isSessionKey="true">
			<DefaultValue></DefaultValue>
			<HelpInfo>默认80</HelpInfo>
		</parameter>
		<parameter id="nginxTimeout" boxStyle="Input" valueValidate="/\d+/" 
			name="Niginx超时时间" displayOrder="5" isEdit="true" 
			isDisplay="false" mustInput="false" isSessionKey="false">
			<DefaultValue>100</DefaultValue>
			<HelpInfo>Niginx超时时间</HelpInfo>
			<errorInfo>请输入整数</errorInfo>
		</parameter>
		</PluginInitParameters>
		</Plugin>
