<?xml version="1.0" encoding="UTF-8"?>
<Plugin version="1.0" id="vmPlugin5.5" name="vmPlugin5.5"
	class="com.mainsteam.stm.plugin.vmware.ESXiPluginSessionFivePointFive" xmlns:xsi="http://www.w3.org/2001/XMLSchema-instance"
	xsi:noNamespaceSchemaLocation="../schema/Plugin.xsd">
	<MaxActiveSession>1</MaxActiveSession>
	<MaxidleSession>0</MaxidleSession>
	<SessionTTL>10000</SessionTTL>
	<ObjectCacheTimeout>30000</ObjectCacheTimeout>
	<PluginInitParameters>
		<parameter id="SshGrpBox" boxStyle="GroupBox" name="主机连接信息"
			displayOrder="1" isEdit="false" isDisplay="true" isSessionKey="false">
			<DefaultValue />
			<HelpInfo>主机连接信息 vcenter6</HelpInfo>
		</parameter>

		<parameter id="IP" boxStyle="IPField" name="IP地址"
			displayOrder="1"
			valueValidate="/^([0,1]?\d{0,2}|2[0-4]\d|25[0-5])\.([0,1]?\d{0,2}|2[0-4]\d|25[0-5])\.([0,1]?\d{0,2}|2[0-4]\d|25[0-5])\.([0,1]?\d{0,2}|2[0-4]\d|25[0-5])$/"
			isEdit="true" isDisplay="true" isSessionKey="true" mustInput="true">
			<DefaultValue></DefaultValue>
			<HelpInfo>待发现机器的IP地址</HelpInfo>
			<errorInfo>请输入正确的IP格式，例如192.168.0.1</errorInfo>
		</parameter>
		<parameter id="vmPort" boxStyle="Input" name="HTTPS端口" valueValidate="/^([0-9]|[1-9]\d|[1-9]\d{2}|[1-9]\d{3}|[1-5]\d{4}|6[0-4]\d{3}|65[0-4]\d{2}|655[0-2]\d|6553[0-5])$/"
			displayOrder="2" isEdit="true" isDisplay="false" mustInput="true"
			isSessionKey="true">
			<DefaultValue>443</DefaultValue>
			<HelpInfo>HTTPS端口，默认为43</HelpInfo>
			<errorInfo>请输入整数</errorInfo>
		</parameter>
		<parameter id="username" boxStyle="Input" name="用户名"
			displayOrder="3" isEdit="true" isDisplay="true" isSessionKey="true"
			type="user" mustInput="true">
			<DefaultValue></DefaultValue>
			<HelpInfo>待发现机器的用户名</HelpInfo>
		</parameter>
		<parameter id="password" boxStyle="Input" name="密码"
			displayOrder="4" isEdit="true" isDisplay="true" isSessionKey="true"
			type="passsword" isPassword="true" mustInput="true">
			<DefaultValue></DefaultValue>
			<HelpInfo>待发现机器的密码</HelpInfo>
		</parameter>

	</PluginInitParameters>
</Plugin>
