<?xml version="1.0" encoding="UTF-8"?>
<Plugin version="1.0" id="HttpPlugin" name="HttpPlugin"
        class="com.mainsteam.stm.plugin.http.HttpPluginSession" xmlns:xsi="http://www.w3.org/2001/XMLSchema-instance"
        xsi:noNamespaceSchemaLocation="../schema/Plugin.xsd">
    <MaxActiveSession>1</MaxActiveSession>
    <MaxidleSession>0</MaxidleSession>
    <SessionTTL>10000</SessionTTL>
    <ObjectCacheTimeout>30000</ObjectCacheTimeout>

    <PluginInitParameters>

        <parameter id="HttpGrpBox" boxStyle="GroupBox" name="Http连接信息"
                   displayOrder="1" isEdit="false" isDisplay="true" isSessionKey="false">
            <DefaultValue/>
            <HelpInfo>Http连接信息</HelpInfo>
        </parameter>

        <parameter id="IP" boxStyle="IPField" name="IP地址"
                   displayOrder="1" isEdit="true" isDisplay="true" isSessionKey="true" mustInput="true">
            <DefaultValue/>
            <HelpInfo>IP地址</HelpInfo>
        </parameter>

        <parameter id="port" boxStyle="Input"
                   valueValidate="/^([0-9]|[1-9]\d|[1-9]\d{2}|[1-9]\d{3}|[1-5]\d{4}|6[0-4]\d{3}|65[0-4]\d{2}|655[0-2]\d|6553[0-5])$/"
                   name="端口" displayOrder="2" isEdit="true" isDisplay="true" mustInput="true" isSessionKey="true">
            <DefaultValue>443</DefaultValue>
            <HelpInfo>端口</HelpInfo>
            <errorInfo>请输入整数</errorInfo>
        </parameter>

        <parameter id="username" boxStyle="Input" name="用户名"
                   displayOrder="3" isEdit="true" isDisplay="true" isSessionKey="true">
            <DefaultValue/>
            <HelpInfo>用户名</HelpInfo>
        </parameter>

        <parameter id="password" boxStyle="Input" name="密码"
                   displayOrder="4" isEdit="true" isDisplay="true" isSessionKey="true" isPassword="true">
            <DefaultValue/>
            <HelpInfo>密码</HelpInfo>
        </parameter>

        <parameter id="protocol" boxStyle="OptionBox" name="协议"
                   displayOrder="5" isEdit="true" isDisplay="true" isSessionKey="true" mustInput="true">
            <DefaultValue>https</DefaultValue>
            <SupportValues>
                <SupportValue>
                    <Name>http</Name>
                    <Value>http</Value>
                </SupportValue>
                <SupportValue>
                    <Name>https</Name>
                    <Value>https</Value>
                </SupportValue>
            </SupportValues>
            <HelpInfo>协议</HelpInfo>
        </parameter>

        <parameter id="timeout" boxStyle="Input" name="超时时间" valueValidate="/\d+/"
                   displayOrder="10" isEdit="true" isDisplay="true" unit="ms">
            <DefaultValue>5000</DefaultValue>
            <HelpInfo>超时时间</HelpInfo>
        </parameter>

        <parameter id="serviceType" boxStyle="OptionBox" name="Http服务类型"
                   displayOrder="20" isEdit="true" isDisplay="false" isSessionKey="true" mustInput="true">
            <DefaultValue/>
            <SupportValues>
                <SupportValue>
                    <Name>CiscoTelePresenceMCU</Name>
                    <Value>CiscoTelePresenceMCU</Value>
                </SupportValue>
                <SupportValue>
                    <Name>CiscoTelePresenceServer</Name>
                    <Value>CiscoTelePresenceServer</Value>
                </SupportValue>
                <SupportValue>
                    <Name>CiscoTelePresenceSupervisor</Name>
                    <Value>CiscoTelePresenceSupervisor</Value>
                </SupportValue>
                <SupportValue>
                    <Name>CiscoTelePresenceConductor</Name>
                    <Value>CiscoTelePresenceConductor</Value>
                </SupportValue>
                <SupportValue>
                    <Name>CiscoTelePresenceContentServer</Name>
                    <Value>CiscoTelePresenceContentServer</Value>
                </SupportValue>
            </SupportValues>
            <HelpInfo>Http服务类型</HelpInfo>
        </parameter>

    </PluginInitParameters>
</Plugin>
